##FILE_TYPE,問題DATA,,,,,,,,,,,,,,,,,,,
594,73,"1,2,3,4,5,6,11,12,13,14,15,16,17",7,1,第2章　高校基礎語200,§3　形容詞・副詞40,128,382,perfect,per<A>fect,,1,完全な；正確な,副詞形,perfectly,,,"<S>Whether your <SJ> homework is <B>perfect</B> or not is not important</S>, as long as you do your best.",最善を尽くしたのであれば，宿題が<B>完璧で</B>あるかないかは問題ではない。,
595,73,6,7,1,第2章　高校基礎語200,§3　形容詞・副詞40,128,382,perfect,per<A>fect,,1,完全な；正確な,名詞形,perfection,,,"<S>Whether your <SJ> homework is <B>perfect</B> or not is not important</S>, as long as you do your best.",最善を尽くしたのであれば，宿題が<B>完璧で</B>あるかないかは問題ではない。,
596,73,6,7,1,第2章　高校基礎語200,§3　形容詞・副詞40,128,382,perfect,per<A>fect,,1,完全な；正確な,反義語,imperfect,,,"<S>Whether your <SJ> homework is <B>perfect</B> or not is not important</S>, as long as you do your best.",最善を尽くしたのであれば，宿題が<B>完璧で</B>あるかないかは問題ではない。,
597,73,"1,2,3,4,6,11,12,13,14,15,16,17",7,1,第2章　高校基礎語200,§3　形容詞・副詞40,128,383,dead,dead,,,死んだ，死んでいる,名詞形,death,,,<S>A wolf was found <B>dead</B> in the woods</S> last week.,森で先週，オオカミが<B>死体で</B>発見された。,
598,73,6,7,1,第2章　高校基礎語200,§3　形容詞・副詞40,128,383,dead,dead,,,死んだ，死んでいる,動詞形,die,,,<S>A wolf was found <B>dead</B> in the woods</S> last week.,森で先週，オオカミが<B>死体で</B>発見された。,
599,73,6,7,1,第2章　高校基礎語200,§3　形容詞・副詞40,128,383,dead,dead,,,死んだ，死んでいる,形容詞形「死にかかっている」,dying,,,<S>A wolf was found <B>dead</B> in the woods</S> last week.,森で先週，オオカミが<B>死体で</B>発見された。,
600,73,"1,2,3,4,5,6,11,12,13,14,15,16,17",7,1,第2章　高校基礎語200,§3　形容詞・副詞40,128,384,excited,ex<A>cit<A>ed,,2,（人が）興奮した，わくわくした,形容詞形「興奮させる」,exciting,,,<S><SB>I'm very <B>excited</B> about my first journey</S> to a foreign country.,私は最初の海外旅行にとても<B>興奮して</B>いる。,
601,73,6,7,1,第2章　高校基礎語200,§3　形容詞・副詞40,128,384,excited,ex<A>cit<A>ed,,2,（人が）興奮した，わくわくした,名詞形,excitement,,,<S><SB>I'm very <B>excited</B> about my first journey</S> to a foreign country.,私は最初の海外旅行にとても<B>興奮して</B>いる。,
602,73,6,7,1,第2章　高校基礎語200,§3　形容詞・副詞40,128,384,excited,ex<A>cit<A>ed,,2,（人が）興奮した，わくわくした,動詞形,excite,,,<S><SB>I'm very <B>excited</B> about my first journey</S> to a foreign country.,私は最初の海外旅行にとても<B>興奮して</B>いる。,
603,73,"1,2,3,4,5,6,8,10,11,12,13,14,15,16,17",7,1,第2章　高校基礎語200,§3　形容詞・副詞40,130,385,asleep,a<A>sleep,,2,眠って,動詞形,sleep,fall asleep,眠りにおちる,"I tried to call you last night, but <S><SB>I think you were already <B>asleep</B></S>.",私は昨夜あなたに電話しようとしたのですが，もう<B>寝て</B>いたのだと思います。,
604,73,"6,8,10",7,1,第2章　高校基礎語200,§3　形容詞・副詞40,130,385,asleep,a<A>sleep,,2,眠って,形容詞形「眠気を感じている」,sleepy,be sound asleep,ぐっすり寝ている,"I tried to call you last night, but <S><SB>I think you were already <B>asleep</B></S>.",私は昨夜あなたに電話しようとしたのですが，もう<B>寝て</B>いたのだと思います。,
605,73,"1,2,3,4,6,8,10,11,12,13,14,15,16,17",7,1,第2章　高校基礎語200,§3　形容詞・副詞40,130,386,proud,proud,,,誇らしげな；自慢して,副詞形,proudly,be proud of ~ / take pride in ~,〜を誇りに思う,<S>My mother was <B>proud</B> of me</S> for passing the exam.,母は私が試験に合格したことを<B>誇りに思って</B>いた。,
606,73,6,7,1,第2章　高校基礎語200,§3　形容詞・副詞40,130,386,proud,proud,,,誇らしげな；自慢して,名詞形,pride　,,,<S>My mother was <B>proud</B> of me</S> for passing the exam.,母は私が試験に合格したことを<B>誇りに思って</B>いた。,
607,73,"1,2,3,4,6,11,12,13,14,15,16,17",7,1,第2章　高校基礎語200,§3　形容詞・副詞40,130,387,shy,shy,,,恥ずかしがりの，内気な,名詞形,shyness,,,<S><SB>Annie was too <B>shy</B> to talk to</S> her friend's brother.,アニーはとても<B>内気な</B>ので，友だちの兄さんに話すこともできなかった。,
608,73,"1,2,3,4,5,6,11,12,13,14,15,16,17",7,1,第2章　高校基礎語200,§3　形容詞・副詞40,130,388,alive,a<A>live,,2,生きて；活動して,類義語「生きている」,living,,,"<S>When she was <B>alive</B>, she worked for many years</S> as a designer.",彼女は<B>生きて</B>いたとき，デザイナーとして長年活躍していた。,
609,73,6,7,1,第2章　高校基礎語200,§3　形容詞・副詞40,130,388,alive,a<A>live,,2,生きて；活動して,関連語「生の」,live,,,"<S>When she was <B>alive</B>, she worked for many years</S> as a designer.",彼女は<B>生きて</B>いたとき，デザイナーとして長年活躍していた。,
610,73,"1,2,3,4,5,11,12,13,14,15,16,17",7,1,第2章　高校基礎語200,§3　形容詞・副詞40,132,389,friendly,friend<A>ly,,1,好意的な；親しい，仲がいい,名詞形,friendliness,,,"He is always cheerful and full of joy in class, <S>and <B>friendly</B> to new students</S>.",彼はいつもクラスで陽気で楽しさにあふれており，新しく加わった生徒には<B>好意的に</B>接している。,
611,73,6,7,1,第2章　高校基礎語200,§3　形容詞・副詞40,132,389,friendly,friend<A>ly,,1,好意的な；親しい，仲がいい,反義語,unfriendly,,,"He is always cheerful and full of joy in class, <S>and <B>friendly</B> to new students</S>.",彼はいつもクラスで陽気で楽しさにあふれており，新しく加わった生徒には<B>好意的に</B>接している。,
612,73,"1,2,3,4,11,12,13,14,15,16,17",7,1,第2章　高校基礎語200,§3　形容詞・副詞40,132,390,cute,cute,,,かわいい,,,,,<S>That <SJ> puppy in the pet shop is really <B>cute</B></S>!,ペットショップのその子犬はとても<B>かわいい</B>！,
613,73,"1,2,3,4,5,6,8,10,11,12,13,14,15,16,17",7,1,第2章　高校基礎語200,§3　形容詞・副詞40,132,391,absent,ab<A>sent,,1,不在の，欠席の,名詞形,absence,be absent from ~ / absent oneself from ~,〜を欠席している,"I'm worried about Bill, <S>as he is <B>absent</B> from school today</S>.",私はビルのことが心配だ，というのも今日学校を<B>欠席して</B>いるからだ。,
614,73,6,7,1,第2章　高校基礎語200,§3　形容詞・副詞40,132,391,absent,ab<A>sent,,1,不在の，欠席の,反義語,present,be absent from ~ / absent oneself from ~,〜を欠席している,"I'm worried about Bill, <S>as he is <B>absent</B> from school today</S>.",私はビルのことが心配だ，というのも今日学校を<B>欠席して</B>いるからだ。,
615,73,"1,2,3,4,6,8,10,11,12,13,14,15,16,17",7,1,第2章　高校基礎語200,§3　形容詞・副詞40,132,392,fond,fond,,,〜を好んで；優しい,名詞形,fondness,be fond of ~,〜が好きである,"<S>She is <B>fond</B> of chocolate and honey</S>, and eats them every day.",彼女はチョコレートとハチミツが<B>好きで</B>，毎日食べている。,
616,73,"1,2,3,4,6,11,12,13,14,15,16,17",7,1,第2章　高校基礎語200,§3　形容詞・副詞40,132,393,main,main,,,主な，主要な,副詞形,mainly,,,<S>The <B>main</B> problem is how to move the machine</S> to the factory.,<B>一番の</B>問題は，その機械をどうやって工場に運ぶかだ。,
617,73,6,7,1,第2章　高校基礎語200,§3　形容詞・副詞40,132,393,main,main,,,主な，主要な,類義語「主要な」,chief,,,<S>The <B>main</B> problem is how to move the machine</S> to the factory.,<B>一番の</B>問題は，その機械をどうやって工場に運ぶかだ。,
618,73,"1,2,3,4,5,6,11,12,13,14,15,16,17",7,1,第2章　高校基礎語200,§3　形容詞・副詞40,132,394,dirty,dirt<A>y,,1,汚い，汚れた,名詞形,dirt,,,"I have not cleaned the screen this month, <S>and it is very <B>dirty</B> with dust</S>.",今月はまだスクリーンを掃除していないので，ほこりまみれで<B>汚い</B>。,
619,73,6,7,1,第2章　高校基礎語200,§3　形容詞・副詞40,132,394,dirty,dirt<A>y,,1,汚い，汚れた,反義語,clean,,,"I have not cleaned the screen this month, <S>and it is very <B>dirty</B> with dust</S>.",今月はまだスクリーンを掃除していないので，ほこりまみれで<B>汚い</B>。,
620,73,"1,2,3,4,5,11,12,13,14,15,16,17",7,1,第2章　高校基礎語200,§3　形容詞・副詞40,134,395,early,ear<A>ly,,1,（時間的に）早く,,,,,<S>You will have to leave <B>early</B></S> if you want to be in time for the film.,映画に間に合うようにしたいのなら，<B>早く</B>出かけたほうがいいよ。,
621,73,"1,2,3,4,8,10,11,12,13,14,15,16,17",7,1,第2章　高校基礎語200,§3　形容詞・副詞40,134,396,soon,soon,,,間もなく，やがて；早く，早めに,,,as soon as S+V,SVするとすぐに,<S><SB>I hope that there will be peace <B>soon</B></S>.,私は<B>すぐに</B>平和が訪れることを期待している。,
622,73,"8,10",7,1,第2章　高校基礎語200,§3　形容詞・副詞40,134,396,soon,soon,,,間もなく，やがて；早く，早めに,,,as soon as possible,できるだけ早く,<S><SB>I hope that there will be peace <B>soon</B></S>.,私は<B>すぐに</B>平和が訪れることを期待している。,
623,73,"1,2,3,4,5,8,10,11,12,13,14,15,16,17",7,1,第2章　高校基礎語200,§3　形容詞・副詞40,134,397,together,to<A>geth<A>er,,2,共に，一緒に；合わせて,,,get together,集まる；団結する,"If it's all right with you, <S>we could go to the movie <B>together</B></S>.",もしよかったら，<B>一緒に</B>映画へ行きませんか。,
624,73,"8,10",7,1,第2章　高校基礎語200,§3　形容詞・副詞40,134,397,together,to<A>geth<A>er,,2,共に，一緒に；合わせて,,,put ~ together,〜を組み立てる,"If it's all right with you, <S>we could go to the movie <B>together</B></S>.",もしよかったら，<B>一緒に</B>映画へ行きませんか。,
625,73,"1,2,3,4,8,10,11,12,13,14,15,16,17",7,1,第2章　高校基礎語200,§3　形容詞・副詞40,134,398,quite,quite,,,全く，すっかり；（否定語と共に用いて）完全には〜ではない,,,quite a few [a little],（数・量が）かなりたくさんの,"His plan was very good, <S>but it was not <B>quite</B> perfect</S>.",彼の計画はとてもよかったが，<B>全く</B>完全だというわけではなかった。,
626,73,"1,2,3,4,5,6,11,12,13,14,15,16,17",7,1,第2章　高校基礎語200,§3　形容詞・副詞40,134,399,maybe,may<A>be,,1,たぶん，もしかしたら,類義語「ひょっとして」,perhaps,,,<S><B>Maybe</B> he is too busy to answer the phone</S>.,<B>たぶん</B>彼は忙しすぎて電話に出られないのかもしれない。,
627,73,"1,2,3,4,5,8,10,11,12,13,14,15,16,17",7,1,第2章　高校基礎語200,§3　形容詞・副詞40,134,400,again,a<A>gain,,2,もう一度，再び,,,again and again,何度も何度も,<S><SB>I would like to visit <SB>New <SJ> <SB>York <B>again</B></S> early next year.,私は来年早いうちにニューヨークを<B>再び</B>訪れたいものだ。,
628,73,"1,2,3,4,6,11,12,13,14,15,16,17",9,1,第3章　高校必修語(1)200,§1　動詞60,142,401,increase,increase,,2,増える，増加する，〜を増やす；増加,副詞形,increasingly,,,<S>The number of tourists visiting <SB>Japan has <B>increased</B></S>.,日本を訪れる観光客の数は<B>増えた</B>。,
629,73,5,9,1,第3章　高校必修語(1)200,§1　動詞60,142,401,increase,in<A>crease,（動詞）,2,増える，増加する，〜を増やす；増加,副詞形,increasingly,,,<S>The number of tourists visiting <SB>Japan has <B>increased</B></S>.,日本を訪れる観光客の数は<B>増えた</B>。,
630,73,"1,2,3,4,5,6,8,10,11,12,13,14,15,16,17",9,1,第3章　高校必修語(1)200,§1　動詞60,142,402,expect,ex<A>pect,,2,〜を期待する，〜を予想する,名詞形「期待；予想」,expectation,expect O to do,Oがdoするのを期待する,<S>He <B>expected</B> me to buy him a present</S> for his birthday.,彼は私が誕生日プレゼントを買ってやるのを<B>期待していた</B>。,
631,73,6,9,1,第3章　高校必修語(1)200,§1　動詞60,142,402,expect,ex<A>pect,,2,〜を期待する，〜を予想する,名詞形「見込み」,expectancy,expect O to do,Oがdoするのを期待する,<S>He <B>expected</B> me to buy him a present</S> for his birthday.,彼は私が誕生日プレゼントを買ってやるのを<B>期待していた</B>。,
632,73,"1,2,3,4,6,8,10,11,12,13,14,15,16,17",9,1,第3章　高校必修語(1)200,§1　動詞60,142,403,hurt,hurt,,,〜を傷つける，痛む,類義語「〜を傷つける」,wound,hurt ~'s feelings,〜の気持ちを傷つける,"<S><SB>I didn't want to <B>hurt</B> him</S>, but I had to tell him what I thought.",私は彼を<B>傷つけ</B>たくはなかったが，考えていることを伝えなければならなかった。,
633,73,"1,2,3,4,5,6,11,12,13,14,15,16,17",9,1,第3章　高校必修語(1)200,§1　動詞60,142,404,create,cre<A>ate,,2,〜を創造する；創作する,名詞形「創造」,creation,,,<S>This painting was <B>created</B> by a young artist</S> from this area.,この絵はこの地域出身の若い画家によって<B>創作された</B>。,
634,73,6,9,1,第3章　高校必修語(1)200,§1　動詞60,142,404,create,cre<A>ate,,2,〜を創造する；創作する,人を表す名詞,creator,,,<S>This painting was <B>created</B> by a young artist</S> from this area.,この絵はこの地域出身の若い画家によって<B>創作された</B>。,
635,73,6,9,1,第3章　高校必修語(1)200,§1　動詞60,142,404,create,cre<A>ate,,2,〜を創造する；創作する,形容詞形,creative,,,<S>This painting was <B>created</B> by a young artist</S> from this area.,この絵はこの地域出身の若い画家によって<B>創作された</B>。,
636,73,"1,2,3,4,11,12,13,14,15,16,17",9,1,第3章　高校必修語(1)200,§1　動詞60,142,405,guess,guess,,,〜を推測する,,,,,<S><SB>I <B>guess</B> that maybe he was alive</S> after the accident.,私は，事故の後でも彼は生きていたと<B>思う</B>。,
637,73,"1,2,3,4,5,6,8,10,11,12,13,14,15,16,17",9,1,第3章　高校必修語(1)200,§1　動詞60,142,406,appear,ap<A>pear,,2,〜に見える；現れる,名詞形,appearance,appear to be C,Cのように見える,"He stayed silent, <S>but he <B>appeared</B> to be excited</S>.",彼は黙ったままだったが，興奮しているように<B>見えた</B>。,
638,73,6,9,1,第3章　高校必修語(1)200,§1　動詞60,142,406,appear,ap<A>pear,,2,〜に見える；現れる,形容詞形,apparent,appear to be C,Cのように見える,"He stayed silent, <S>but he <B>appeared</B> to be excited</S>.",彼は黙ったままだったが，興奮しているように<B>見えた</B>。,
639,73,6,9,1,第3章　高校必修語(1)200,§1　動詞60,142,406,appear,ap<A>pear,,2,〜に見える；現れる,反義語,disappear,appear to be C,Cのように見える,"He stayed silent, <S>but he <B>appeared</B> to be excited</S>.",彼は黙ったままだったが，興奮しているように<B>見えた</B>。,
640,73,"1,2,3,4,6,11,12,13,14,15,16,17",9,1,第3章　高校必修語(1)200,§1　動詞60,144,407,hang,hang,,,〜をかける，つるす，垂らす,名詞形,hanger,,,<S><SB>Mary <B>hung</B> the clock on the wall</S> and set it to the right time.,メアリーは壁にその時計を<B>かけ</B>，正しい時刻に合わせた。,
641,73,"1,2,3,4,5,6,8,10,11,12,13,14,15,16,17",9,1,第3章　高校必修語(1)200,§1　動詞60,144,408,mistake,mis<A>take,,2,〜を誤解する，間違える,形容詞形,mistaken,mistake A for B,AをBと間違える,<S>He <B>mistook</B> my coat for his</S> and wore it home.,彼は私のコートを自分のと<B>間違えて</B>，それを着て家に帰った。,
642,73,6,9,1,第3章　高校必修語(1)200,§1　動詞60,144,408,mistake,mis<A>take,,2,〜を誤解する，間違える,副詞形,mistakenly,mistake A for B,AをBと間違える,<S>He <B>mistook</B> my coat for his</S> and wore it home.,彼は私のコートを自分のと<B>間違えて</B>，それを着て家に帰った。,
643,73,"1,2,3,4,8,10,11,12,13,14,15,16,17",9,1,第3章　高校必修語(1)200,§1　動詞60,144,409,shout,shout,,,叫ぶ，大声で話す；大声,,,shout for joy,嬉しくて大声を上げる,<S><SB>Bill <B>shouted</B> to me across the river</S>.,ビルは川の反対側から私に<B>叫んだ</B>。,
644,73,"1,2,3,4,11,12,13,14,15,16,17",9,1,第3章　高校必修語(1)200,§1　動詞60,144,410,beat,beat,,,〜を打つ，たたく；（相手・敵）を負かす；殴打,名詞形,beating,,,"When I cleaned my room, <S><SB>I <B>beat</B> the blankets and hung them out</S>.",私は部屋を掃除をしたとき，毛布を<B>はたき</B>，外へつるした。,
645,73,6,9,1,第3章　高校必修語(1)200,§1　動詞60,144,410,beat,beat,,,〜を打つ，たたく；（相手・敵）を負かす；殴打,類義語,hit / strike,,,"When I cleaned my room, <S><SB>I <B>beat</B> the blankets and hung them out</S>.",私は部屋を掃除をしたとき，毛布を<B>はたき</B>，外へつるした。,
646,73,"1,2,3,4,5,6,11,12,13,14,15,16,17",9,1,第3章　高校必修語(1)200,§1　動詞60,144,411,occur,oc<A>cur,,2,起こる；（考えなどが）人の心に浮かぶ,名詞形,occurrence,,,<S>The accident <B>occurred</B> some time last night</S>.,その事故は，昨夜のある時に<B>起きた</B>。,
647,73,"1,2,3,4,11,12,13,14,15,16,17",9,1,第3章　高校必修語(1)200,§1　動詞60,144,412,flow,flow,,,流れる，流れ出る；流れ,,,,,<S>The river <B>flows</B> along the narrow valley</S> for a length of three miles.,その川は，狭い谷間に沿って3マイルの長さにわたり<B>流れている</B>。,
648,73,"1,2,3,4,6,11,12,13,14,15,16,17",9,1,第3章　高校必修語(1)200,§1　動詞60,144,413,match,match,,,〜に匹敵する；〜に調和する,類義語「試合」,game,,,<S>Do you think these boots <B>match</B> my dress</S>?,このブーツは私のドレスに<B>合う</B>と思いますか。,
649,73,"1,2,3,4,5,6,8,10,11,12,13,14,15,16,17",9,1,第3章　高校必修語(1)200,§1　動詞60,144,414,belong,be<A>long,,2,所属している；〜の所有物である,名詞形「所有物」,belonging,belong to ~,〜のものだ；〜に所属する,"<S><SB>I think that car <B>belongs</B> to <SB>Jim</S>, but I may be mistaken.",私はその車がジムの<B>ものだ</B>と思うが，間違っているかもしれない。,
650,73,"1,3,4,11,12,13,14,15,16,17",9,1,第3章　高校必修語(1)200,§1　動詞60,146,415,draw,draw,,,〜を引っぱる，引き出す；（図・絵）を（線で）描く,名詞形「絵」,drawing,,,"<S><SB>I like to <B>draw</B> pictures of small animals</S>, like puppies.",私は子犬のような小さな動物の絵を<B>描く</B>のが好きです。,
651,73,2,9,1,第3章　高校必修語(1)200,§1　動詞60,146,415,draw,draw,,,〜を引っぱる，引き出す；（図・絵）を<CR>（線で）描く,名詞形「絵」,drawing,,,"<S><SB>I like to <B>draw</B> pictures of small animals</S>, like puppies.",私は子犬のような小さな動物の絵を<B>描く</B>のが好きです。,
652,73,6,9,1,第3章　高校必修語(1)200,§1　動詞60,146,415,draw,draw,,,〜を引っぱる，引き出す；（図・絵）を（線で）描く,名詞形「引き出し」,drawer,,,"<S><SB>I like to <B>draw</B> pictures of small animals</S>, like puppies.",私は子犬のような小さな動物の絵を<B>描く</B>のが好きです。,
653,73,"1,2,3,4,5,6,11,12,13,14,15,16,17",9,1,第3章　高校必修語(1)200,§1　動詞60,146,416,settle,set<A>tle,,1,定住する；落ち着く,名詞形「定住；解決」,settlement,,,<S>My family <B>settled</B> in this area</S> when I was about ten years old.,私の家族は，私が10歳くらいのときこの地域に<B>定住した</B>。,
654,73,6,9,1,第3章　高校必修語(1)200,§1　動詞60,146,416,settle,set<A>tle,,1,定住する；落ち着く,人を表す名詞,settler,,,<S>My family <B>settled</B> in this area</S> when I was about ten years old.,私の家族は，私が10歳くらいのときこの地域に<B>定住した</B>。,
655,73,"1,2,3,4,11,12,13,14,15,16,17",9,1,第3章　高校必修語(1)200,§1　動詞60,146,417,spread,spread,,,広がる，〜を広げる,,,,,<S>The water <B>spread</B> slowly across the floor</S>.,水はゆっくりと床に<B>広がった</B>。,
656,73,"1,2,3,4,5,6,11,12,13,14,15,16,17",9,1,第3章　高校必修語(1)200,§1　動詞60,146,418,copy,cop<A>y,,1,〜を写す；〜をまねる；写し，複写,名詞形「複写機」,copier,,,<S>Can <SB>I <B>copy</B> your notes for <SB>English class</S>?,あなたがとった英語の授業のノートを<B>写して</B>もいいですか？,
657,73,6,9,1,第3章　高校必修語(1)200,§1　動詞60,146,418,copy,cop<A>y,,1,〜を写す；〜をまねる；写し，複写,関連語「著作権」,copyright,,,<S>Can <SB>I <B>copy</B> your notes for <SB>English class</S>?,あなたがとった英語の授業のノートを<B>写して</B>もいいですか？,
658,73,"1,2,3,4,8,10,11,12,13,14,15,16,17",9,1,第3章　高校必修語(1)200,§1　動詞60,146,419,wake,wake,,,目覚める，〜を目覚めさせる,,,wake up ~,〜を起こす,"<S><SB>I <B>woke</B> at about six o'clock this morning</S>, but soon went back to sleep.",私は今朝6時に<B>目が覚めた</B>が，またすぐに寝てしまった。,
659,73,"1,2,3,4,6,11,12,13,14,15,16,17",9,1,第3章　高校必修語(1)200,§1　動詞60,146,420,steal,steal,,,〜を盗む，盗みをする,同音語,steel,,,<S>He was caught trying to <B>steal</B> some food</S> from the chain store.,彼はそのチェーンストアで食べ物を<B>盗もう</B>としているところを見つかった。,
660,73,6,9,1,第3章　高校必修語(1)200,§1　動詞60,146,420,steal,steal,,,〜を盗む，盗みをする,名詞形,stealth,,,<S>He was caught trying to <B>steal</B> some food</S> from the chain store.,彼はそのチェーンストアで食べ物を<B>盗もう</B>としているところを見つかった。,
661,73,"1,2,3,4,6,11,12,13,14,15,16,17",9,1,第3章　高校必修語(1)200,§1　動詞60,146,421,bite,bite,,,〜をかむ，〜にかみつく,同音語,byte,,,<S><SB>Mary was <B>bitten</B> by the dog</S> that lives next door.,メアリは隣に住んでいる犬に<B>かみつかれた</B>。,
662,73,6,9,1,第3章　高校必修語(1)200,§1　動詞60,146,421,bite,bite,,,〜をかむ，〜にかみつく,形容詞形,biting,,,<S><SB>Mary was <B>bitten</B> by the dog</S> that lives next door.,メアリは隣に住んでいる犬に<B>かみつかれた</B>。,
663,73,"1,2,3,4,5,6,11,12,13,14,15,16,17",9,1,第3章　高校必修語(1)200,§1　動詞60,148,422,borrow,bor<A>row,,1,〜を借りる，借用する,反義語,lend,,,<S>Could <SB>I <B>borrow</B> some money until next week</S>?,来週までお金を<B>お借りして</B>もよろしいでしょうか。,
664,73,"1,2,3,4,6,8,10,11,12,13,14,15,16,17",9,1,第3章　高校必修語(1)200,§1　動詞60,148,423,lend,lend,,,〜を貸す,反義語,borrow,lend O1+O2,O1にO2を貸す,<S>She <B>lent</B> me her necklace with jewels</S>.,彼女は彼女の宝石のついたネックレスを私に<B>貸してくれた</B>。,
665,73,"1,2,3,4,6,8,10,11,12,13,14,15,16,17",9,1,第3章　高校必修語(1)200,§1　動詞60,148,424,earn,earn,,,（金）をもうける，稼ぐ,名詞形,earning,earn a living　,生計を立てる,<S><SB>John <B>earns</B> a lot of money from buying</S> and selling cars.,ジョンは車の売買で多くの金を<B>稼いでいる</B>。,
666,73,"1,2,3,4,5,6,11,12,13,14,15,16,17",9,1,第3章　高校必修語(1)200,§1　動詞60,148,425,recycle,re<A>cy<A>cle,,2,〜を再生利用する,名詞形,recycling,,,<S>It's important to <B>recycle</B> newspapers</S> as much as you can.,できるだけ新聞紙を<B>再生利用する</B>ことが大切です。,
667,73,"1,2,3,4,5,6,11,12,13,14,15,16,17",9,1,第3章　高校必修語(1)200,§1　動詞60,148,426,comment,com<A>ment,,1,論評する；意見を述べる,人を表す名詞,commentator,,,<S>Did anyone <B>comment</B> on the new plan</S>?,だれかこの新しい計画に<B>意見を述べました</B>か。,
668,73,6,9,1,第3章　高校必修語(1)200,§1　動詞60,148,426,comment,com<A>ment,,1,論評する；意見を述べる,名詞形「解説書」,commentary,,,<S>Did anyone <B>comment</B> on the new plan</S>?,だれかこの新しい計画に<B>意見を述べました</B>か。,
669,73,"1,2,3,4,6,8,10,11,12,13,14,15,16,17",9,1,第3章　高校必修語(1)200,§1　動詞60,148,427,shoot,shoot,,,（〜を）撃つ，射撃する,名詞形「射撃」,shooting,shoot at ~,〜をねらって撃つ,"<S>He <B>shot</B> at the wolf</S>, but he missed it.",彼はそのオオカミをねらって<B>撃った</B>が，外した。,
